{
  "document": {
    "revision": 1,
    "schema_version": "1.0",
    "stable_id": "ofef:demo:fmea:brake-assembly-process",
    "type": "FMEADocument"
  },
  "entities": [
    {
      "description": "Demo project for the first Open-FMEA vertical slice.",
      "name": "Brake Assembly Launch",
      "revision": 1,
      "schema_version": "1.0",
      "stable_id": "demo:project:brake-assembly",
      "type": "FMEAProject"
    },
    {
      "description": "",
      "name": "Brake Caliper Assembly",
      "part_number": "BC-DEMO-001",
      "revision": 1,
      "schema_version": "1.0",
      "stable_id": "demo:product:brake-caliper",
      "type": "Product"
    },
    {
      "description": "Seal must prevent fluid leakage under operating load.",
      "name": "Maintain hydraulic pressure",
      "operation_id": "demo:operation:station-20",
      "product_id": "demo:product:brake-caliper",
      "revision": 1,
      "schema_version": "1.0",
      "stable_id": "demo:function:seal-fluid-pressure",
      "type": "Function"
    },
    {
      "description": "",
      "name": "Assembly Process",
      "process_code": "ASM-20",
      "revision": 1,
      "schema_version": "1.0",
      "stable_id": "demo:process:assembly",
      "type": "Process"
    },
    {
      "description": "",
      "name": "Install piston seal",
      "process_id": "demo:process:assembly",
      "revision": 1,
      "schema_version": "1.0",
      "sequence": "20",
      "stable_id": "demo:operation:station-20",
      "type": "Operation"
    },
    {
      "attributes": {
        "nominal": "controlled manual insertion",
        "observed": "operator-dependent variation"
      },
      "cause_category_id": "cause-category:ishikawa-5me:method",
      "description": "Force applied while seating the piston seal.",
      "name": "Seal installation force",
      "operation_id": "demo:operation:station-20",
      "revision": 1,
      "schema_version": "1.0",
      "stable_id": "demo:process-characteristic:installation-force",
      "type": "ProcessCharacteristic"
    },
    {
      "description": "",
      "function_id": "demo:function:seal-fluid-pressure",
      "name": "Leak rate below customer limit",
      "revision": 1,
      "schema_version": "1.0",
      "source_reference": "REQ-DEMO-042",
      "stable_id": "demo:requirement:leak-rate",
      "type": "Requirement"
    },
    {
      "description": "",
      "is_special": true,
      "name": "Seal seat surface condition",
      "primary_classification_id": null,
      "requirement_id": "demo:requirement:leak-rate",
      "revision": 1,
      "schema_version": "1.0",
      "stable_id": "demo:characteristic:seal-seat-condition",
      "type": "ProductCharacteristic"
    },
    {
      "description": "Piston seal does not hold pressure after final assembly.",
      "fmea_id": "demo:fmea:brake-assembly-process",
      "function_id": "demo:function:seal-fluid-pressure",
      "name": "Seal leaks after assembly",
      "requirement_id": "demo:requirement:leak-rate",
      "revision": 1,
      "schema_version": "1.0",
      "stable_id": "demo:failure-mode:seal-leak",
      "type": "FailureMode"
    },
    {
      "description": "",
      "failure_mode_id": "demo:failure-mode:seal-leak",
      "name": "Reduced braking performance",
      "revision": 1,
      "schema_version": "1.0",
      "stable_id": "demo:effect:loss-of-braking",
      "type": "FailureEffect"
    },
    {
      "description": "",
      "failure_mode_id": "demo:failure-mode:seal-leak",
      "name": "Seal nicked during installation",
      "revision": 1,
      "schema_version": "1.0",
      "stable_id": "demo:cause:seal-nicked",
      "type": "FailureCause"
    },
    {
      "description": "",
      "failure_cause_id": "demo:cause:seal-nicked",
      "name": "Sharp edge contacts seal lip",
      "revision": 1,
      "schema_version": "1.0",
      "stable_id": "demo:mechanism:sharp-edge-contact",
      "type": "FailureMechanism"
    },
    {
      "control_type": "prevention",
      "description": "",
      "failure_cause_id": "demo:cause:seal-nicked",
      "name": "Chamfer verification before assembly",
      "revision": 1,
      "schema_version": "1.0",
      "stable_id": "demo:prevention:chamfer-check",
      "type": "PreventionControl"
    },
    {
      "control_type": "detection",
      "description": "",
      "failure_cause_id": "demo:cause:seal-nicked",
      "name": "Pressure decay leak test",
      "revision": 1,
      "schema_version": "1.0",
      "stable_id": "demo:detection:pressure-decay",
      "type": "DetectionControl"
    },
    {
      "description": "",
      "detection_control_id": "demo:detection:pressure-decay",
      "name": "Automated leak tester",
      "revision": 1,
      "schema_version": "1.0",
      "stable_id": "demo:measurement:leak-tester",
      "type": "MeasurementMethod",
      "unit": "mbar/min"
    },
    {
      "description": "",
      "due_date": null,
      "failure_cause_id": "demo:cause:seal-nicked",
      "failure_mode_id": "demo:failure-mode:seal-leak",
      "name": "Add seal installation guide fixture",
      "responsible_role_id": "demo:role:manufacturing-engineer",
      "revision": 1,
      "schema_version": "1.0",
      "stable_id": "demo:action:add-installation-guide",
      "status": "in_progress",
      "type": "RecommendedAction"
    },
    {
      "description": "",
      "name": "Manufacturing Engineer",
      "revision": 1,
      "schema_version": "1.0",
      "stable_id": "demo:role:manufacturing-engineer",
      "type": "ResponsibleRole"
    },
    {
      "action_id": "demo:action:add-installation-guide",
      "description": "",
      "name": "Fixture trial record",
      "reference_uri": "demo://fixture-trial-001",
      "revision": 1,
      "schema_version": "1.0",
      "stable_id": "demo:evidence:fixture-trial",
      "type": "Evidence"
    },
    {
      "configuration": {
        "variant": "configurable-poc-matrix"
      },
      "method": "aiag-vda-ap-poc",
      "name": "Action Priority PoC Matrix",
      "rating_scales": {
        "detection": {
          "maximum": 10,
          "minimum": 1
        },
        "occurrence": {
          "maximum": 10,
          "minimum": 1
        },
        "severity": {
          "maximum": 10,
          "minimum": 1
        }
      },
      "revision": 1,
      "schema_version": "1.0",
      "stable_id": "demo:evaluation-definition:action-priority-poc",
      "type": "EvaluationDefinition"
    },
    {
      "configuration": {
        "formula": "severity * occurrence * detection"
      },
      "method": "classic-rpn",
      "name": "Classic RPN",
      "rating_scales": {
        "detection": {
          "maximum": 10,
          "minimum": 1
        },
        "occurrence": {
          "maximum": 10,
          "minimum": 1
        },
        "severity": {
          "maximum": 10,
          "minimum": 1
        }
      },
      "revision": 1,
      "schema_version": "1.0",
      "stable_id": "demo:evaluation-definition:classic-rpn",
      "type": "EvaluationDefinition"
    },
    {
      "cause_category_id": "cause-category:ishikawa-5me:method",
      "confidence": null,
      "evidence_ids": [],
      "influence_type": "produces",
      "review_note": "Demo: installation method can damage the seal.",
      "revision": 1,
      "schema_version": "1.0",
      "source_context": "seed_demo",
      "source_id": "demo:cause:seal-nicked",
      "source_type": "FailureCause",
      "stable_id": "demo:cause-influence:seal-nicked-method",
      "status": "possible",
      "strength": "medium",
      "target_id": "demo:failure-mode:seal-leak",
      "target_type": "FailureMode",
      "type": "CauseInfluence"
    },
    {
      "description": "Work method, setup, sequence, and process instruction factors.",
      "name": "Method",
      "revision": 1,
      "schema_version": "1.0",
      "scheme_id": "cause-category-scheme:ishikawa-5me-default",
      "sort_order": 4,
      "stable_id": "cause-category:ishikawa-5me:method",
      "type": "CauseCategory"
    },
    {
      "description": "Default configurable cause-category scheme for Ishikawa review.",
      "name": "Ishikawa 5M+E (default)",
      "revision": 1,
      "schema_version": "1.0",
      "stable_id": "cause-category-scheme:ishikawa-5me-default",
      "type": "CauseCategoryScheme"
    },
    {
      "cause_category_id": "cause-category:ishikawa-5me:machine",
      "confidence": null,
      "evidence_ids": [
        "demo:evidence:fixture-trial"
      ],
      "influence_type": "contributes_to",
      "review_note": "Demo: fixture trial linked the sharp edge to seal damage.",
      "revision": 1,
      "schema_version": "1.0",
      "source_context": "seed_demo",
      "source_id": "demo:mechanism:sharp-edge-contact",
      "source_type": "FailureMechanism",
      "stable_id": "demo:cause-influence:sharp-edge-machine",
      "status": "correlated",
      "strength": "high",
      "target_id": "demo:failure-mode:seal-leak",
      "target_type": "FailureMode",
      "type": "CauseInfluence"
    },
    {
      "description": "Equipment, tooling, fixtures, and machine condition.",
      "name": "Machine",
      "revision": 1,
      "schema_version": "1.0",
      "scheme_id": "cause-category-scheme:ishikawa-5me-default",
      "sort_order": 2,
      "stable_id": "cause-category:ishikawa-5me:machine",
      "type": "CauseCategory"
    }
  ],
  "evaluations": [
    {
      "actor": "seed_demo",
      "evaluated_at": "2026-08-30T12:00:00+00:00",
      "evaluation_definition_id": "demo:evaluation-definition:action-priority-poc",
      "failure_mode_id": "demo:failure-mode:seal-leak",
      "inputs": {
        "detection": 5,
        "occurrence": 4,
        "severity": 9
      },
      "method": "aiag-vda-ap-poc",
      "result": {
        "priority": "high",
        "variant": "configurable-poc-matrix"
      },
      "revision": 1,
      "schema_version": "1.0",